video_id,trending_date,title,channel_title,category_id,publish_time,tags,views,likes,dislikes,comment_count,thumbnail_link,comments_disabled,ratings_disabled,video_error_or_removed,description,country,trending_date_std,publish_time_std,trending_date_std_iter,publish_time_std_iter,delta_tendencia,dias_hasta_tendencia,horas_hasta_tendencia,categoria_velocidad
_I_D_8Z4sJE,18.07.04,Nicky Jam x J. Balvin - X (EQUIS) | Video Oficial | Prod. Afro Bros & Jeon,NickyJamTV,10,2018-03-02T05:00:19.000Z,"Bad Bunny|""Amorfoda""|""Dura""|""Daddy Yankee""|""Ozuna""|""Romeo Santos""|""El Farsante Remix""|""Drake""|""God’s Plan""|""Luis Fonsi""|""Demi Lovato""|""Échame La Culpa""|""Sobredosis""|""Maluma""|""Corazón""|""Nego do Borel""|""Ed Sheeran""|""Perfect""|""Shape of You""|""Camila Cabello""|""Havana""|""Young Thug""|""Wisin""|""Yandel""|""Todo Comienza en la Disco""|""Piso 21""|""Déjala Que Vuelva""|""Manuel Turizo""|""Despacito""|""Síguelo Bailando""|""Reik""|""Me Niego""|""Bella Wolfine""",424538912,2818771,149275,99380,https://i.ytimg.com/vi/_I_D_8Z4sJE/default.jpg,False,False,False,"Disponible en tu plataforma preferida:\nhttps://goo.gl/b8TDFS \n\nNicky Jam y J. Balvin performing X \nNuevo video de Nicky Jam 2018\n\nLetra de EQUIS X \n\nAquel día te vi y tu energia sentí\nDesde eso no te quiero lejos de mi\nSé que no sabes de mi y no te puedo mentir\nLo que dicen en la calle sobre mi\n\nY no te voy a negar\nEstamos claros y ya\nNo te lo voy a negar (no te lo puedo negar)\nEstamos claros y ya (estamos claros, estamos claros)\n\nSolo deja que yo te agarre baby\nBesos en el cuello pa' calmar la sed\nMi mano en tus caderas pa' empezar como es\nNo le vamo' a bajar mas nunca mamá\n\nBa-Ba-Ba-Ba-Baila\nPlacata Placata \nComo ella lo mueve\nSin parar, sin parar\n\nMis ganas de comerte\nAhora son mas fuertes\nQuiero tenerte\n\nY no te voy a negar\nEstamos claros y ya\nNo te lo voy a negar\nEstamos claros y ya\n\nLo que he visto de ti mami no me es normal\nPero no te preocupes que soy anormal\nSé que tus amigas no les debo gustar\n\nPero ve y cuentale parte por parte\nComo tenemos sex y te quito el estres\nDale otra vez\n\nY no te voy a negar\nEstamos claros y ya\nNo te lo voy a negar\nEstamos claros y ya\n\nBa-Ba-Ba-Ba- Baila\nPlacata Placata \nComo ella lo mueve\nSin parar, sin parar\n\nMis ganas de comerte\nAhora son mas fuertes\nQuiero tenerte\n\nY no te voy a negar\nEstamos claros y ya\nNo te lo voy a negar\nEstamos claros y ya\n\nLa Industria Inc\nSony Music Latin\n2018\n\nSkloziv Network",GB,2018-04-07,2018-03-02 05:00:19,2018-04-07,2018-03-02 05:00:19,35 days 18:59:41,35,858.9947222222222,lento
9jI-z9QN6g8,18.18.05,"Te Bote Remix - Casper, Nio García, Darell, Nicky Jam, Bad Bunny, Ozuna | Video Oficial",Flow La Movie,10,2018-04-11T22:00:00.000Z,"Te Bote|""Te Bote Remix""|""Flow La Movie""|""Ozuna""|""Nio Garcia""|""Casper""|""Nicky Jam""|""Bad Bunny""|""Darell""",337621571,2581961,166549,113564,https://i.ytimg.com/vi/9jI-z9QN6g8/default.jpg,False,False,False,Flow La Movie Presenta - Te Boté Remix - Casper Nio García Darell Nicky Jam Bad Bunny OzunaDisponible aquí - https://glad.lnk.to/TeBoteRmx,GB,2018-05-18,2018-04-11 22:00:00,2018-05-18,2018-04-11 22:00:00,36 days 02:00:00,36,866.0,lento
kLpH1nSLJSs,18.23.03,Bad Bunny - Amorfoda | Video Oficial,Bad Bunny,10,2018-02-15T00:00:03.000Z,"Bad|""Bunny""|""Bad Bunny""|""Video Oficial""|""Music Video""|""Amor Foda""|""Amorfoda""|""No Quiero Que Nadie Me Hable De Amor""|""Ya Me Canse""|""Que nadie me hable de amor""|""San Valentin""",328860380,3823879,215530,225216,https://i.ytimg.com/vi/kLpH1nSLJSs/default.jpg,False,False,False,Bad Bunny - Amorfoda | Video Oficial\n\n-Click para suscribirte: http://bit.ly/badbunnypr\n\nFollow Me / Sigueme en: \n\nInstagram: https://www.instagram.com/badbunnypr/\nSpotify: http://spoti.fi/2xQk6CX\nFacebook: https://www.facebook.com/BadBunyPR\nTwitter: https://twitter.com/badbunnypr\nApple Music: http://apple.co/2f52tr9\n\nPara contrataciones:  +1 787-566-8600 | BadBunnyInfo@Gmail.com\n\n© 2018 Hear This Music under exclusive license to Rimas Entertainment,GB,2018-03-23,2018-02-15 00:00:03,2018-03-23,2018-02-15 00:00:03,35 days 23:59:57,35,863.9991666666666,lento
wfWkmURBNv8,18.01.03,Ozuna x Romeo Santos - El Farsante Remix,Ozuna,10,2018-01-30T15:00:05.000Z,"Ozuna|""Reggaeton""|""Odisea""|""Odisea The Album""|""Romeo Santos""|""El Farsante Remix""",288811992,1618180,151147,67506,https://i.ytimg.com/vi/wfWkmURBNv8/default.jpg,False,False,False,DESCARGA Odisea Aqui: http://apple.co/2vX00sT\n\nDescarga Odisea The Game:\nApp Store: http://apple.co/2hSmZiO\nAndroid: http://bit.ly/2uwwJFb\n\nFollow Me / Sigueme en: \n\nINSTAGRAM: https://www.instagram.com/ozunapr/\nFACEBOOK: https://www.facebook.com/ozunapr\nTWITTER: https://twitter.com/ozunapr\nSPOTIFY: http://spoti.fi/2tzO4Zv\nAPPLE MUSIC: http://apple.co/2uu3phf\n\nManager: \nVicente Saavedra: Saavedrabooking@gmail.com | +1-787-444-5678,GB,2018-03-01,2018-01-30 15:00:05,2018-03-01,2018-01-30 15:00:05,29 days 08:59:55,29,704.9986111111111,moderado
VYOjWnS4cMY,18.11.06,Childish Gambino - This Is America (Official Video),ChildishGambinoVEVO,10,2018-05-06T04:00:07.000Z,"Childish Gambino|""Rap""|""This Is America""|""mcDJ Recording/RCA Records""",259721696,5444541,379862,553371,https://i.ytimg.com/vi/VYOjWnS4cMY/default.jpg,False,False,False,“This is America” by Childish Gambino http://smarturl.it/TcIgADirector: Hiro MuraiProducer: Jason Cole of Doomsday with Ibra Ake and Fam Rothstein of Wolf + Rothsteintour tickets and merchandise available at childishgambino.com,GB,2018-06-11,2018-05-06 04:00:07,2018-06-11,2018-05-06 04:00:07,35 days 19:59:53,35,859.9980555555555,lento
xpVfcZ0ZcFM,18.25.03,Drake - God’s Plan,DrakeVEVO,10,2018-02-17T05:00:01.000Z,"Drake new music|""Drake Gods Plan""|""Drake God’s Plan""|""Scary Hours""|""Drake Charity Giveaway""|""Drake in Miami""",258164991,4737873,117198,301756,https://i.ytimg.com/vi/xpVfcZ0ZcFM/default.jpg,False,False,False,God’s Plan (Official Video)\n\nSong Available Here: https://Drake.lnk.to/ScaryHoursYD\n\n \n\nDirected by Karena Evans\n\nExecutive Producers Director X & Taj Critchlow\n\nProduced by Fuliane Petikyan\n\nFor Popp Rok\n\n \n\nMusic video by Drake performing God’s Plan.  © 2018 Young Money Entertainment/Cash Money Records\n\nhttp://vevo.ly/Z6Unb9,GB,2018-03-25,2018-02-17 05:00:01,2018-03-25,2018-02-17 05:00:01,35 days 18:59:59,35,858.9997222222222,lento
ffxKSjUwKdU,18.26.05,Ariana Grande - No Tears Left To Cry,ArianaGrandeVevo,10,2018-04-20T04:00:03.000Z,"Ariana|""Grande""|""No""|""Tears""|""Left""|""To""|""Cry""|""Universal""|""Records""|""Pop""",208876887,3394437,150086,259613,https://i.ytimg.com/vi/ffxKSjUwKdU/default.jpg,False,False,False,"No Tears Left To Cry (Official Video)Song Available Here: https://arianagrande.lnk.to/notearsYD Connect with Ariana Grande:https://www.arianagrande.com https://www.instagram.com/arianagrande https://twitter.com/arianagrande https://www.facebook.com/arianagrande Director - Dave MeyersProducer - Nathan ScherrerEditor - Nick GilbergDirector of Photography - Scott CunninghamProduction Designer - Ethan TobmanVisual Fx - BufColourist - Stefan SonnenfeldA FREENJOY PRODUCTIONMusic video by Ariana Grande performing No Tears Left To Cry. © 2018 Republic Records, a Division of UMG Recordings, Inc.http://vevo.ly/zyztMq",GB,2018-05-26,2018-04-20 04:00:03,2018-05-26,2018-04-20 04:00:03,35 days 19:59:57,35,859.9991666666666,lento
zEf423kYfqk,18.26.05,"Becky G, Natti Natasha - Sin Pijama (Official Video)",BeckyGVEVO,10,2018-04-20T10:40:51.000Z,"Becky G|""Natti Natasha""|""Natti Natasha Music""|""Natti Natasha Official Video""|""Natti Natasha Video""|""Natti Natasha Video Oficial""|""Natti Natasha Nuevo Video""|""Natti Natasha New Video""|""Sin Pijama Official Video""|""Official Video""|""Sin Pijama Official Remix Video""|""Sin Pijama Single""|""Single""|""Natti Natasha New Single""|""Natti Natasha Single""|""Natti Natasha Song""|""Sin Pijama new song""|""Sin Pijama nueva canción""|""Natti Natasha nueva cancion""|""Natti""|""Natasha""|""en""",200862743,1668418,142569,97826,https://i.ytimg.com/vi/zEf423kYfqk/default.jpg,False,False,False,"Becky G & Natti Natasha – “Sin Pijama”NUEVO SENCILLO “Sin Pijama” DISPONIBLE AHORA iTunes: http://smarturl.it/SinPijamaI   Apple Music: http://smarturl.it/SinPijamaA  Spotify: http://smarturl.it/SinPijamaSpot  Amazon Music: http://smarturl.it/SinPijamaAm  Google Play: http://smarturl.it/SinPijamaGPDeezer: http://smarturl.it/SinPijamaD ¡Elige tu plataforma de preferencia!: https://SML.lnk.to/SinPijama ESCÚCHA Sin Pijama EN LATINO VIBES ....¡SIGUE ESTE PLAYLIST AHORA PARA ESCÚCHAR NUEVA MÚSICA + LOS MEJORES PUNTOS LATINOS DE HOY!Apple Music: http://smarturl.it/LatinoVibesA   Spotify: http://smarturl.it/LatinoVibesS SIGUE A BECKY G EN: Página web oficial: http://iambeckyg.com Instagram: http://smarturl.it/BeckyGInstagram Facebook: http://smarturl.it/BeckyGFB Twitter: http://smarturl.it/BeckyGTWSIGUE A NATTI NATASHA EN: INSTAGRAM: https://www.instagram.com/nattinatasha/ FACEBOOK: https://www.facebook.com/NattiNatashaOfficial/ Official music video by Becky G, Natti Natasha performing Sin Pijama . (C) 2018 Sony Music Entertainment US Latin LLC",GB,2018-05-26,2018-04-20 10:40:51,2018-05-26,2018-04-20 10:40:51,35 days 13:19:09,35,853.3191666666667,lento
FlsCjmMhFmw,17.24.12,YouTube Rewind: The Shape of 2017 | #YouTubeRewind,YouTube Spotlight,24,2017-12-06T17:58:51.000Z,"Rewind|""Rewind 2017""|""youtube rewind 2017""|""#YouTubeRewind""|""Rewind 2016""|""Dan and Phil""|""Grace Helbig""|""HolaSoyGerman""|""Lilly Singh""|""Markiplier""|""Swoozie""|""Rhett Link""|""Liza Koshy""|""Dolan Twins""|""Lele Pons""|""Jake Paul""|""Logan Paul""|""KSI""|""Joey Graceffa""|""Casey Neistat""|""Poppy""|""Niana Guerrero""|""Daddy Yankee""|""Luis Fonsi""|""Ed Sheeran""|""Kendrick Lamar""|""Stephen Colbert""|""Fidget Spinners""|""Slime""|""Backpack Kid""|""April the Giraffe""|""#Rewind""|""Despacito""|""Shape of you""|""YouTubeRewind""|""I’m the One""|""Humble""",169884583,3312868,1753274,845233,https://i.ytimg.com/vi/FlsCjmMhFmw/default.jpg,False,False,False,"YouTube Rewind 2017. Celebrating the videos, people, music and memes that made 2017. #YouTubeRewind\n\nMeet the featured Creators in Rewind: https://rewind2017.withyoutube.com/creators\nSpend more time with your favorite Creators, videos and trends from 2017: https://yt.be/rewind2017\nTest your Rewind knowledge with our trivia game: http://yt.be/dejaview\n\nWatch trending videos from 2017: http://youtube.com/rewind\nSee the trends as they happen: http://youtube.com/trending\n\nWatch the Behind the Scenes video: https://youtu.be/OIQQ8jmsbMM  \nSee all the Easter Eggs: https://goo.gl/3U9otg\n\nMusic by The Hood Internet: https://www.youtube.com/thehoodinternet\n\nYouTube Rewind 2017 produced by Portal A",GB,2017-12-24,2017-12-06 17:58:51,2017-12-24,2017-12-06 17:58:51,17 days 06:01:09,17,414.01916666666665,moderado
sGIm0-dQd8M,18.14.02,Dura - Daddy Yankee (Video Oficial),Daddy Yankee,10,2018-01-18T22:32:49.000Z,"daddy yankee reggaeton|""daddy yankee youtube""|""music daddy yankee""|""daddy""|""gasolina daddy yankee""|""shaky shaky""|""music video daddy yankee""|""dura""|""despacito""|""machika""|""corazon""|""camila cabello havana""|""perfect""|""echame la culpa""|""ozuna""|""jbalvin""|""bad bunny""|""natti natasha""|""enrique iglesias""|""manuel turizo""",167456025,1633407,74005,65395,https://i.ytimg.com/vi/sGIm0-dQd8M/default.jpg,False,False,False,"Dura - Daddy Yankee - nuevo video oficial 2018\n\nThis is the official Youtube channel from urban music legend, Daddy Yankee \n\n\n\nRecuerda suscribirte a mi unico canal oficial y a mis demás redes sociales: \n\nhttp://www.youtube.com/DaddyYankee \nhttp://www.facebook.com/daddyyankee http://www.instagram.com/daddyyankee \nhttp://www.twitter.com/daddyyankee http://www.daddyyankee.com\n\nEscucha Dura tambien en:\nSpotify: https://goo.gl/LPP4j9\nApple Music: https://goo.gl/s8omcv\nGoogle Play: https://goo.gl/d9V2VV\nTidal: https://goo.gl/44UiYx\nDeezer: https://goo.gl/11jHih\n\nDura Lyrics:\n\nCuando yo la vi, dije si esa mujer fuera para mí\n\nPerdóname, te lo tenía que decir\n\nEstás dura, dura, dura, dura, dura\n\n \n\nQue estás dura,\n\nMano arriba porque tú te ves bien\n\nEstás dura mamacita te fuiste de nivel\n\nDura, mira como brilla tu piel\n\nEstás dura\n\nDímelo, dímelo cómo es que es\n\nEstás dura\n\nYo te doy un 20 de 10\n\nEstás dura, dura, dura\n\n \n\nTú eres la máquina, la máquina de baile\n\nSi no tienes a nadie vente pa mi brazos, caíle.\n\nEse perfume se siente en el aire\n\nAlgo como Argentina tú me traes los Buenos Aires\n\n \n\nEstás poderosa\n\nMedia escandalosa\n\nHabrán muchas mujeres pero tú eres otra cosa\n\n \n\nSi fuera un delito eso de que estás hermosa\n\nTe arresto en mi cama y te pongo las esposas\n\n \n\nTienes el toque, toque, toque\n\nMiren el material, edición especial\n\nTienes el toque, toque, toque\n\nPerdóname te lo tenía que decir\n\nEstás dura, dura, dura, dura, dura\n\n \n\nQue estás dura,\n\nMano arriba porque tú te ves bien\n\nEstás dura mamacita te fuiste de nivel\n\nDura, mira como brilla tu piel\n\nEstás dura\n\nDímelo, dímelo cómo es que es\n\nEstás dura\n\nYo te doy un 20 de 10\n\nEstás dura, dura, dura\n\n \n\nMe gusta como mueve ese rampampam\n\nMi mente maquineando en un plan, plan, plan\n\nSi me deja en esas curvas le doy pam-pam\n\nCuál es tu receta no sé, estás pa comerte bien\n\nMe gusta como mueve ese rampampam\n\nMi mente maquineando en un plan, plan, plan\n\nSi me deja en esas curvas le doy pam-pam\n\nTu belleza retumba, las otra pa la tumba\n\n \n\nUno, dos y tres\n\nVamos a darle, la envidia que se calle,\n\nSaludo a todas las nenas, que paralizan la calle\n\nCómo tú te llamas, de dónde tú eres,\n\nDame el número, pa entrar contigo en detalle\n\nTienes el toque, toque, toque\n\nPareces una estrella, formando el alboroto\n\nTienes el toque, toque, toque\n\nSe cae el internet cuando subes una foto\n\n \n\nCuando yo la vi, dije si esa mujer fuera para mí\n\nPerdóname, te lo tenía que decir\n\nEstás dura, dura, dura, dura, dura\n\n \n\nQue estás dura,\n\nMano arriba porque tú te ves bien\n\nEstás dura mamacita te fuiste de nivel\n\nDura, mira como brilla tu piel\n\nEstás dura\n\nDímelo, dímelo cómo es que es\n\nEstás dura\n\nYo te doy un 20 de 10\n\nEstás dura, dura, dura\n\n \n\nTu tienes el size,\n\nOtra como tú, mami no hay\n\nPégate dale boom bye, bye,\n\nQue tu tienes el size,\n\nOtra como tú, mami no hay\n\nPégate dale boom bye, bye,\n\nQue tu tienes el size,\n\nOtra como tú, mami no hay\n\nPégate dale boom bye, bye,\n\nQue tu tienes el size,\n\nOtra como tú, mami no hay\n\nPégate dale boom bye, bye,\n\n \n\nRetumbando las bocinas\n\nDe seguro Daddy Yankee y el disco dura\n\ncontact: info@nevarezpr.com",GB,2018-02-14,2018-01-18 22:32:49,2018-02-14,2018-01-18 22:32:49,26 days 01:27:11,26,625.4530555555556,moderado
TyHvyGVs42U,17.01.12,"Luis Fonsi, Demi Lovato - Échame La Culpa",LuisFonsiVEVO,10,2017-11-17T05:00:01.000Z,"Luis|""Fonsi""|""Demi""|""Lovato""|""Échame""|""La""|""Culpa""|""UMLE""|""Latino""|""Latin""|""Pop""",143408235,2686169,137938,144217,https://i.ytimg.com/vi/TyHvyGVs42U/default.jpg,False,False,False,"“Échame La Culpa” disponible ya en todas las plataformas digitales: https://umle.lnk.to/ELCFp\n”Échame La Culpa” available now on all digital platforms: https://umle.lnk.to/ELCFp\n\nMusic video by Luis Fonsi, Demi Lovato performing Échame La Culpa. (C) 2017 UMG Recordings, Inc.\n\nhttp://vevo.ly/FgY9ro",GB,2017-12-01,2017-11-17 05:00:01,2017-12-01,2017-11-17 05:00:01,13 days 18:59:59,13,330.9997222222222,moderado
2Vv-BfVoq4g,17.27.11,Ed Sheeran - Perfect (Official Music Video),Ed Sheeran,10,2017-11-09T11:04:14.000Z,"edsheeran|""ed sheeran""|""acoustic""|""live""|""cover""|""official""|""remix""|""official video""|""lyrics""|""session""",138578860,2584773,49428,113639,https://i.ytimg.com/vi/2Vv-BfVoq4g/default.jpg,False,False,False,"🎧: https://ad.gt/yt-perfect\n💰: https://atlanti.cr/yt-album\nSubscribe to Ed's channel: http://bit.ly/SubscribeToEdSheeran\n\nFollow Ed on...\nFacebook: http://www.facebook.com/EdSheeranMusic\nTwitter: http://twitter.com/edsheeran\nInstagram: http://instagram.com/teddysphotos\nOfficial Website: http://edsheeran.com\n\nDirector | dp Jason Koenig\nProducer: Honna Kimmerer\nStarring: Ed Sheeran & Zoey Deutch \nDirector of Photography: Johnny Valencia\nProduction Company: Anonymous Content\nExec Producer: Nina Soriano\nProduction Manager: Doug Hoff\nCommissioner: Dan Curwin\nProduction Designer: John Lavin\nLead Casting: Amy Hubbard \n \nWritten by: Jason Koenig, Ed Sheeran, Jenny Koenig, Andrew Kolvet, Murray Cummings\n\nEdited by: Jason Koenig & Johnny Valencia\nVFX: Ian Hubert\nGraphic design by Chris Ballasciotes\n\nCast: Bo Valencia, Dennis Ranalta, Arthur Pauli\n \nSki Cinematography: Corey Koniniec\nSpecialty Camera op: Ryan Haug\n1st AC: Ryan Brown\n \n1st Assistant Director: Ole Zapatka\nArt Director: Klaus Hartl\nSnow fx: Lucien Stephenson\n\nGaffer: Thomas Berz\nStylist: Claudia Lajda\nHair & Makeup: Christel Thoresen\nAustrian Casting: Ursula Kiplinger\n \nAdditional VFX: Zoic\n\nSpecial Thanks to: The Hintertux Glacier, Austria;\nHohenhaus Tenne, and Hotel Neuhintertux",GB,2017-11-27,2017-11-09 11:04:14,2017-11-27,2017-11-09 11:04:14,17 days 12:55:46,17,420.92944444444447,moderado
M4ZoCHID9GI,18.19.05,The Weeknd - Call Out My Name (Official Video),TheWeekndVEVO,10,2018-04-12T16:00:04.000Z,"The|""Weeknd""|""Call""|""Out""|""My""|""Name""",138535053,1493942,44048,57119,https://i.ytimg.com/vi/M4ZoCHID9GI/default.jpg,False,False,False,"Call Out My Name (Official Video)Taken from the album My Dear Melancholy,http://theweeknd.co/mdmYD Connect with The Weeknd:http://www.facebook.com/theweeknd http://instagram.com/theweeknd https://soundcloud.com/theweeknd https://twitter.com/TheWeeknd https://www.theweeknd.com Directed by Grant SingerPRODUCER – Saul GermaineEXECUTIVE PRODUCER – Nina SorianoFor Anonymous ContentDIRECTOR OF PHOTOGRAPHY – Alexis ZabePRODUCTION DESIGNER – Page BucknerEDITOR – Nate Gross for Exile EditCOLORIST – Simon Bourne for FramestoreVFX – The Mill VFX SUPERVISOR – David LawsonVFX CREATIVE DIRECTOR – Becky Porter2D LEAD ARTIST – Jason Bergman3D LEAD ARTIST – David LawsonAUDIO MIXER – Adam Primack for Lime StudiosMusic video by The Weeknd performing Call Out My Name. © 2018 The Weeknd XO, Inc., Manufactured and Marketed by Republic Records, a Division of UMG Recordings, Inc.http://vevo.ly/wvSjbc",GB,2018-05-19,2018-04-12 16:00:04,2018-05-19,2018-04-12 16:00:04,36 days 07:59:56,36,871.9988888888889,lento
Ck4xHocysLw,18.02.06,Ozuna - Única (Video Oficial) 🐻 A U R A,Ozuna,10,2018-04-26T17:52:13.000Z,"Ozuna|""Reggaeton""|""Odisea""|""Odisea The Album""|""Unica""|""Única""",137081637,824296,44012,27109,https://i.ytimg.com/vi/Ck4xHocysLw/default.jpg,False,False,False,DESCARGA Odisea Aqui: http://apple.co/2vX00sTDescarga Odisea The Game:App Store: http://apple.co/2hSmZiOAndroid: http://bit.ly/2uwwJFbFollow Me / Sigueme en: INSTAGRAM: https://www.instagram.com/ozunapr/FACEBOOK: https://www.facebook.com/ozunaprTWITTER: https://twitter.com/ozunaprSPOTIFY: http://spoti.fi/2tzO4ZvAPPLE MUSIC: http://apple.co/2uu3phfManager: Vicente Saavedra: Saavedrabooking@gmail.com | +1-787-444-5678,GB,2018-06-02,2018-04-26 17:52:13,2018-06-02,2018-04-26 17:52:13,36 days 06:07:47,36,870.1297222222222,lento
7C2z4GqqS5E,18.01.06,BTS (방탄소년단) 'FAKE LOVE' Official MV,ibighit,10,2018-05-18T09:00:02.000Z,"BIGHIT|""빅히트""|""방탄소년단""|""BTS""|""BANGTAN""|""방탄""|""FAKE LOVE""|""FAKE_LOVE""|""fake love""",123010920,5613827,206892,1228655,https://i.ytimg.com/vi/7C2z4GqqS5E/default.jpg,False,False,False,"BTS (방탄소년단) 'FAKE LOVE' Official MVDirector : YongSeok Choi (Lumpens)Assistant Director : WonJu Lee, Guzza, HyeJeong Park, MinJe Jeong (Lumpens)Director of Photography : HyunWoo Nam(GDW)Gaffer : HyunSuk Song (Real Lighting)Art Director : JinSil Park Bona Kim (MU:E)Construction Manager : SukKi Song Special Effect : DemolitionBigHit Entertainment. Rights are reserved selectively in the video.Unauthorized reproduction is a violation of applicable laws. Manufactured by BigHit Entertainment, Seoul, KoreaConnect with BTS:http://www.ibighit.com http://twitter.com/BTS_bighit http://twitter.com/BTS_twt https://www.facebook.com/ibighit/http://www.facebook.com/bangtan.officialhttp://instagram.com/BTS.bighitofficialhttp://weibo.com/BTSbighitBU content certified by Big Hit Entertainment",US,2018-06-01,2018-05-18 09:00:02,2018-06-01,2018-05-18 09:00:02,13 days 14:59:58,13,326.99944444444446,moderado
tCXGJQYZ9JA,18.17.04,Taylor Swift - Delicate,TaylorSwiftVEVO,10,2018-03-12T01:15:10.000Z,"Taylor Swift|""Delicate""|""Big""|""Machine""|""Records""|""LLC""|""Pop""",117270304,2161260,133428,175635,https://i.ytimg.com/vi/tCXGJQYZ9JA/default.jpg,False,False,False,Taylor Swift reputation Stadium Tour Tickets are on sale now. Get tickets here: http://taylor.lk/repEvents\n\nMusic video by Taylor Swift performing Delicate. ©2018 Big Machine Label Group LLC\n\nhttp://vevo.ly/hIoRmf,GB,2018-04-17,2018-03-12 01:15:10,2018-04-17,2018-03-12 01:15:10,35 days 22:44:50,35,862.7472222222223,lento
U9BwWKXjVaI,18.13.05,Drake - Nice For What,DrakeVEVO,10,2018-04-07T02:46:31.000Z,"Drake|""Nice""|""For""|""What""|""Young""|""Money""|""Hip""|""Hop""",106147032,1275948,52924,65066,https://i.ytimg.com/vi/U9BwWKXjVaI/default.jpg,False,False,False,Music video by Drake performing Nice For What. © 2018 Young Money/Cash Money Records,GB,2018-05-13,2018-04-07 02:46:31,2018-05-13,2018-04-07 02:46:31,35 days 21:13:29,35,861.2247222222222,lento
au2n7VVGv_c,18.28.04,Post Malone - Psycho ft. Ty Dolla $ign,PostMaloneVEVO,10,2018-03-23T04:00:00.000Z,"Post|""Malone""|""Psycho""|""Universal""|""Records""|""Hip""|""Hop""",105629911,1340938,41651,45784,https://i.ytimg.com/vi/au2n7VVGv_c/default.jpg,False,False,False,"Psycho ft. Ty Dolla $ign (Official Video)\nSong Available Now!\nhttps://PostMalone.lnk.to/psychoYD\n\nMerch Available Here!\nhttps://postmaloneshop.com\n\nFor More Post Malone Info\nhttps://postmalone.com \n\nDirected by James DeFina\nProduced by Ryan Hahn\nEdited by Ben Montemayor\nFor HPLA\n\nMusic video by Post Malone performing Psycho. © 2018 Republic Records, a division of UMG Recordings, Inc.\n\nhttp://vevo.ly/8PYdFB",GB,2018-04-28,2018-03-23 04:00:00,2018-04-28,2018-03-23 04:00:00,35 days 20:00:00,35,860.0,lento
6ZfuNTqbHE8,17.14.12,Marvel Studios' Avengers: Infinity War Official Trailer,Marvel Entertainment,24,2017-11-29T13:26:24.000Z,"marvel|""comics""|""comic books""|""nerdy""|""geeky""|""super hero""|""superhero""|""avengers: infinity war""|""avengers""|""infinity war""|""marvel studios""",100672931,2701353,56313,368739,https://i.ytimg.com/vi/6ZfuNTqbHE8/default.jpg,False,False,False,"There was an idea… Avengers: Infinity War. In theaters May 4.\n\n► Subscribe to Marvel: http://bit.ly/WeO3YJ\n\nFollow Marvel on Twitter: ‪https://twitter.com/marvel\nLike Marvel on FaceBook: ‪https://www.facebook.com/Marvel\n\nFor even more news, stay tuned to:\nTumblr: ‪http://marvelentertainment.tumblr.com/\nInstagram: https://www.instagram.com/marvel\nGoogle+: ‪https://plus.google.com/+marvel\nPinterest: ‪http://pinterest.com/marvelofficial",GB,2017-12-14,2017-11-29 13:26:24,2017-12-14,2017-11-29 13:26:24,14 days 10:33:36,14,346.56,moderado
fGqdIPer-ms,18.24.04,Migos - Walk It Talk It ft. Drake,MigosVEVO,10,2018-03-18T21:49:53.000Z,"Migos|""Walk It""|""Talk It""|""Walk Talk""|""Walk It Talk It""|""Drake""|""Quavo""|""Offset""|""Takeoff""|""Culture""|""Culture II""|""Culture 2""|""Don Cornelius""|""Jamie Foxx""|""Soul Train""",100159686,1339372,67821,73838,https://i.ytimg.com/vi/fGqdIPer-ms/default.jpg,False,False,False,"Listen to Culture II everywhere now: https://Migos.lnk.to/Culture2YD\n\nPurchase exclusive Migos merch featured from their official store: https://Migos.lnk.to/StoreYD\n\nFollow Migos:\nhttps://facebook.com/THEMigosAtl\nhttps://twitter.com/migos\nhttps://instagram.com/migos\n\nCheck out GIFS from this video at: https://giphy.com/Migos\n\nDirector: Daps & Quavo\nProducer: Sara Lacombe\nExecutive Producers: Daps & Sara Lacombe\nSecond Unit Director: Joseph Desrosiers\nDirector of Photography: Corey Jennings\nStylist: Zoe Costello\nBackground Stylist: Rasheeda Ameera\nVideo Commissioner: Sara Lacombe & Kevin Kloecker\n\nMusic video by Migos performing Walk It Talk It. (C) 2018 Quality Control Music, LLC and UMG Recordings, Inc.\n\nhttp://vevo.ly/RJgyLa",GB,2018-04-24,2018-03-18 21:49:53,2018-04-24,2018-03-18 21:49:53,36 days 02:10:07,36,866.1686111111111,lento
